title,year,genre,plot,runtime (minutes),RT rating (%),imdb rating
Lady Bird,2017,"Comedy, Drama","A fiercely independent teenager tries to make her own way in the world while wanting to get out of her hometown of Sacramento, California, and to get away from her complicated mother and recently-unemployed father.",94,99,7.4
Persepolis,2007,"Animation, Biography, Drama",A precocious and outspoken Iranian girl grows up during the Islamic Revolution.,96,96,8
Star Trek,2009,"Action, Adventure, Sci-Fi",The brash James T. Kirk tries to live up to his father's legacy with Mr. Spock keeping him in check as a vengeful Romulan from the future creates black holes to destroy the Federation one planet at a time.,127,94,7.9
Hell or High Water,2016,"Crime, Drama, Thriller","Toby is a divorced father who's trying to make a better life. His brother is an ex-con with a short temper and a loose trigger finger. Together, they plan a series of heists against the bank that's about to foreclose on their family ranch.",102,97,7.6
Memento,2000,"Mystery, Thriller",A former insurance investigator who now suffers from anterograde amnesia uses notes and tattoos to hunt down his wife's murderer.,113,94,8.4
Catch Me if You Can,2002,"Biography, Crime, Drama","Barely 17 yet, Frank is a skilled forger who has passed as a doctor, lawyer and pilot. FBI agent Carl becomes obsessed with tracking down the con man, who only revels in the pursuit.",141,96,8.1
Star Wars: Episode IV - A New Hope,1977,"Action, Adventure, Fantasy",Deleted scenes from Star Wars: Episode IV - A New Hope (1977).,121,94,8.6
Shadow of a Doubt,1943,"Film-Noir, Thriller","A teenage girl, overjoyed when her uncle comes to visit the family in their quiet California town, slowly begins to suspect that he is the ""Merry Widow"" killer sought by the authorities.",108,100,7.8
Mr. Smith Goes to Washington,1939,"Comedy, Drama","A naive youth leader is appointed to fill a vacancy in the U.S. Senate. His idealistic plans promptly collide with corruption at home and subterfuge from his hero in Washington, but he tries to forge ahead despite attacks on his character.",129,97,8.1
Ratatouille,2007,"Animation, Adventure, Comedy",A rat who can cook makes an unusual alliance with a young kitchen worker at a famous Paris restaurant.,111,96,8.1
Brooklyn,2015,"Drama, Romance","An Irish immigrant lands in 1950s Brooklyn, where she quickly falls into a romance with a local. When her past catches up with her, however, she must choose between two countries and the lives that exist within.",117,97,7.5
Saving Private Ryan,1998,"Drama, War","Following the Normandy Landings, a group of U.S. soldiers go behind enemy lines to retrieve a paratrooper whose comrades have been killed in action.",169,94,8.6
The Lavender Hill Mob,1951,"Comedy, Crime",A meek bank clerk who oversees the shipment of bullion joins with an eccentric neighbor to steal gold bars and smuggle them out of the country as miniature Eiffel Towers.,78,100,7.5
Raiders of the Lost Ark,1981,"Action, Adventure","In 1936, archaeologist Indiana Jones is tasked by Army Intelligence to help locate a legendary ancient power, the Ark of Covenant, before the Nazis get it first.",115,94,8.4
WALL-E,2008,"Animation, Adventure, Family","After the death of her husband, Tabatha- a young, tattooed, rebellious horse trainer- wrestles with financial insecurity and unresolved grief while providing refuge for a group of wayward teenagers on her broken-down ranch in the Badlands.",98,95,8.4
I Am Cuba,1964,Drama,Four vignettes about the lives of the Cuban people set during the pre-revolutionary era.,141,100,8.2
Maria Full of Grace,2004,"Crime, Drama",A pregnant Colombian teenager becomes a drug mule to make some desperately-needed money for her family.,101,97,7.4
Ali: Fear Eats the Soul,1974,"Drama, Romance","A lonely widow meets a much younger Moroccan worker in a bar during a rainstorm. They fall in love, to their own surprise and to the outright shock of their families, colleagues, and drinking buddies.",93,100,8
The Iron Giant,1999,"Animation, Action, Adventure",A young boy befriends a giant robot from outer space that a paranoid government agent wants to destroy.,86,96,8.1
The Passion of Joan of Arc,1928,"Biography, Drama, History",The Passion of Joan of Arc,114,98,8.1
The King's Speech,2010,"Biography, Drama, History","The story of King George VI, his unexpected ascension to the throne of the British Empire in 1936, and the speech therapist who helped the unsure monarch overcome his stammer.",118,94,8
Spider-Man: No Way Home,2021,"Action, Adventure, Fantasy","With Spider-Man's identity now revealed, Peter asks Doctor Strange for help. When a spell goes wrong, dangerous foes from other worlds start to appear.",148,93,8.2
The Bridge on the River Kwai,1957,"Adventure, Drama, War","British POWs are forced to build a railway bridge across the river Kwai for their Japanese captors in occupied Burma, not knowing that the allied forces are planning a daring commando raid through the jungle to destroy it.",161,96,8.1
The Farewell,2019,"Comedy, Drama","A Chinese family discovers their grandmother has only a short while left to live and decide to keep her in the dark, scheduling a wedding to gather before she dies.",100,97,7.5
The Adventures of Robin Hood,1938,"Action, Adventure, Romance","When Prince John and the Norman Lords begin oppressing the Saxon masses in King Richard's absence in 1190s England, a Saxon lord fights back as the outlaw leader of a resistance movement.",102,100,7.9
Whiplash,2014,"Drama, Music",A promising young drummer enrolls at a cut-throat music conservatory where his dreams of greatness are mentored by an instructor who will stop at nothing to realize a student's potential.,106,94,8.5
Meet Me in St. Louis,1944,"Comedy, Drama, Family",Young love and childish fears highlight a year in the life of a turn-of-the-century family.,113,99,7.5
The Insider,1999,"Biography, Drama, History",A research chemist comes under personal and professional attack when he decides to appear in a 60 Minutes exposé on Big Tobacco.,157,96,7.8
Monty Python and the Holy Grail,1975,"Adventure, Comedy, Fantasy","King Arthur and his Knights of the Round Table embark on a surreal, low-budget search for the Holy Grail, encountering many, very silly obstacles.",91,92,8.2
Das Boot,1981,"Drama, War",A German U-boat stalks the frigid waters of the North Atlantic as its young crew experience the sheer terror and claustrophobic life of a submariner in World War II.,149,98,8.4
Pinocchio,1940,"Animation, Adventure, Comedy","A father's wish magically brings a wooden boy to life in Italy, giving him a chance to care for the child.",88,100,7.5
Star Wars: Episode V - The Empire Strikes Back,1980,"Action, Adventure, Fantasy","After the Empire overpowers the Rebel Alliance, Luke Skywalker begins training with Jedi Master Yoda, while Darth Vader and bounty hunter Boba Fett pursue his friends across the galaxy.",124,93,8.7
Dog Day Afternoon,1975,"Biography, Crime, Drama","Three amateur robbers plan to hold up a Brooklyn bank. A nice, simple robbery: Walk in, take the money, and run. Unfortunately, the supposedly uncomplicated heist suddenly becomes a bizarre nightmare as everything that could go wrong does.",125,96,8
Aladdin,1992,"Animation, Adventure, Comedy","Aladdin, a kind thief, woos Jasmine, the princess of Agrabah, with the help of Genie. When Jafar, the grand vizier, tries to usurp the king, Jasmine, Aladdin and Genie must stop him from succeeding.",90,96,8
Avengers: Endgame,2019,"Action, Adventure, Sci-Fi","After the devastating events of Avengers: Infinity War (2018), the universe is in ruins. With the help of remaining allies, the Avengers assemble once more in order to reverse Thanos' actions and restore balance to the universe.",181,94,8.4
Rashomon,1950,"Crime, Drama, Mystery","The rape of a bride and the murder of her samurai husband are recalled from the perspectives of a bandit, the bride, the samurai's ghost and a woodcutter.",88,98,8.2
Touch of Evil,1958,"Crime, Drama, Film-Noir","A Mexican official and his American wife are targeted in a Texas border town by the crime family he's trying to put behind bars for drug trafficking, as his concern grows over the tactics of the local detective whose cooperation he needs.",95,97,8
Iron Man,2008,"Action, Adventure, Sci-Fi","After being held captive in an Afghan cave, billionaire engineer Tony Stark creates a unique weaponized suit of armor to fight evil.",126,94,7.9
Little Women,2019,"Drama, Romance","In 19th century Massachusetts, the March sisters--Meg, Jo, Beth, and Amy--on the threshold of womanhood, go through many ups and downs in life and endeavor to make important decisions about their futures.",135,95,7.8
The Handmaiden,2016,"Drama, Romance, Thriller","In 1930s Korea, a girl is hired as a handmaiden to a Japanese heiress who lives a secluded life on a countryside estate. But the maid has a secret: She is a pickpocket recruited by a swindler to help seduce the Lady and steal her fortune.",145,96,8.1
The Band's Visit,2007,"Comedy, Drama, Music","A band comprised of members of the Egyptian police force head to Israel to play at the inaugural ceremony of an Arab arts center, only to find themselves lost in the wrong town.",87,98,7.5
Ran,1985,"Action, Drama, War","In Medieval Japan, an elderly warlord retires, handing over his empire to his three sons. However, he vastly underestimates how the new-found power will corrupt them and cause them to turn on each other...and him.",160,96,8.2
The Hurt Locker,2008,"Drama, Thriller, War","During the Iraq War, a Sergeant recently assigned to an army bomb squad is put at odds with his squad mates due to his maverick way of handling his work.",131,96,7.5
The Red Shoes,1948,"Drama, Music, Romance",A young ballet dancer is torn between the man she loves and her pursuit to become a prima ballerina.,135,98,8.1
Leave No Trace,2018,"Adventure, Drama","A father and his seventeen-year-old daughter are living an ideal existence in a vast urban park in Portland, Oregon when a small mistake derails their lives forever.",109,100,7.1
Casino Royale,2006,"Action, Adventure, Thriller","After earning a licence to kill, secret agent James Bond sets out on his first mission as 007. Bond must defeat a private banker funding terrorists in a high-stakes game of poker at Casino Royale, in Montenegro.",144,94,8
Top Hat,1935,"Comedy, Musical, Romance","An American dancer comes to Britain and falls for a model whom he initially annoyed, but she mistakes him for his goofy producer.",101,100,7.7
The Conformist,1970,Drama,"A weak-willed Italian man becomes a fascist flunky who goes abroad to arrange the assassination of his old teacher, now a political dissident.",113,98,7.9
The Artist,2011,"Comedy, Drama, Romance","When George, a silent movie superstar, meets Peppy Miller, a dancer, sparks fly between the two. However, after the introduction of talking pictures, their fortunes change, affecting their dynamic.",100,95,7.8
Unforgiven,1992,"Drama, Western","Retired Old West gunslinger Will Munny reluctantly takes on one last job to avenge an injustice with the help of his old partner and a young would-be gunman calling himself ""The Schofield Kid"".",130,96,8.2
King Kong,1933,"Adventure, Horror","A greedy film producer assembles a team of moviemakers and sets out for the infamous Skull Island, where they find more than just cannibalistic natives.",100,97,7.9
Strangers on a Train,1951,"Crime, Drama, Film-Noir",A psychopath tries to forcibly persuade a tennis star to agree to his theory that two strangers can get away with murder by submitting to his plan to kill the other's most-hated person.,101,98,7.9
Halloween,1978,"Horror, Thriller","Fifteen years after murdering his sister on Halloween night 1963, Michael Myers escapes from a mental hospital and returns to the small town of Haddonfield, Illinois, to kill again.",91,97,7.7
Paths of Glory,1957,"Drama, War",A colonel defends three of his soldiers in a court-martial after they abandon a suicidal attack.,88,96,8.4
A Prophet,2009,"Crime, Drama","A delinquent Muslim man struggles to get by in prison until he is taken under the wing of a powerful mob boss, but his gradual rise through the organization's ranks brings him in conflict with his mentor.",155,96,7.8
Children of Paradise,1945,"Drama, Romance",The theatrical life of a beautiful courtesan in 1830s Paris and the four men who love her.,189,98,8.3
Before Sunset,2004,"Drama, Romance","Nine years after Jesse and Celine first met, they encounter each other again on the French leg of Jesse's book tour.",80,94,8.1
Sunrise,1927,"Drama, Romance","Explores Panem 24 years before Katniss' saga, starting on the morning of the reaping for the 50th Hunger Games, where a young Haymitch Abernathy participates.",94,98,8.1
Quiz Show,1994,"Biography, Drama, History","A young lawyer, Richard Goodwin, investigates a potentially fixed game show. Charles Van Doren, a big time show winner, is under Goodwin's investigation.",133,97,7.5
Pulp Fiction,1994,"Crime, Drama","The lives of two mob hitmen, a boxer, a gangster and his wife, and a pair of diner bandits intertwine in four tales of violence and redemption.",154,92,8.8
A Beautiful Day in the Neighborhood,2019,"Biography, Drama, Family","Lloyd Vogel, a cynical journalist, gets acquainted with a kind-hearted television host Fred Rogers while writing an article on him. With time, they strike an unlikely friendship.",109,95,7.2
Puss in Boots: The Last Wish,2022,"Animation, Action, Adventure","When Puss in Boots discovers that his passion for adventure has taken its toll and he has burned through eight of his nine lives, he launches an epic journey to restore them by finding the mythical Last Wish.",102,95,7.8
The LEGO Movie,2014,"Animation, Action, Adventure","An ordinary LEGO construction worker, thought to be the prophesied as ""special"", is recruited to join a quest to stop an evil tyrant from gluing the LEGO universe into eternal stasis.",100,96,7.7
Soul,2020,"Animation, Adventure, Comedy","Joe is a middle-school band teacher whose life hasn't quite gone the way he expected. His true passion is jazz. But when he travels to another realm to help someone find their passion, he soon discovers what it means to have soul.",100,95,8
One Flew Over the Cuckoo's Nest,1975,Drama,"A rebellious convict is sent to a psychiatric hospital for evaluation in 1963 Oregon, and encourages his docile companions to take more control of their lives and defy the tyrannical head nurse.",133,93,8.7
Creed,2015,"Action, Drama, Sport","The former World Heavyweight Champion Rocky Balboa serves as a trainer and mentor to Adonis Johnson, the son of his late friend and former rival Apollo Creed.",133,95,7.6
Sweet Smell of Success,1957,"Drama, Film-Noir",A powerful Broadway columnist coerces an unscrupulous press agent into breaking up his sister's romance with a jazz musician.,96,98,8
La Haine,1995,"Crime, Drama",24 hours in the lives of three young men in the French suburbs the day after a violent riot.,98,96,8.1
Kubo and the Two Strings,2016,"Animation, Action, Adventure",A young boy named Kubo must locate a magical suit of armour worn by his late father in order to defeat a vengeful spirit from the past.,101,97,7.7
The Princess Bride,1987,"Adventure, Comedy, Family","A bedridden boy's grandfather reads him the story of a farmboy-turned-pirate who encounters numerous obstacles, enemies and allies in his quest to be reunited with his true love.",98,96,8
Starred Up,2013,"Crime, Drama, Thriller","Eric Love, 19, is locked up in prison. On his first day, he assaults another inmate and several guards. He's offered group therapy and his dad, an inmate as well, tries to talk sense into him. Can he be rehabilitated?",106,99,7.3
John Wick: Chapter 4,2023,"Action, Crime, Thriller","John Wick uncovers a path to defeating The High Table. But before he can earn his freedom, Wick must face off against a new enemy with powerful alliances across the globe and forces that turn old friends into foes.",169,94,7.6
Eternal Sunshine of the Spotless Mind,2004,"Drama, Romance, Sci-Fi","When their relationship turns sour, a couple undergoes a medical procedure to have each other erased from their memories forever.",108,92,8.3
Monsieur Lazhar,2011,"Comedy, Drama","At a Montréal public grade school, an Algerian immigrant is hired to replace a popular teacher who committed suicide in her classroom. While helping his students deal with their grief, his own recent loss is revealed.",95,98,7.5
Aliens,1986,"Action, Adventure, Horror","Decades after surviving the Nostromo incident, Ellen Ripley is sent out to re-establish contact with a terraforming colony but finds herself battling the Alien Queen and her offspring.",137,94,8.4
Sideways,2004,"Comedy, Drama, Romance","Two men reaching middle age with not much to show but disappointment embark on a week-long road trip through California's wine country, just as one is about to take a trip down the aisle.",127,97,7.5
The Lion King,1994,"Animation, Adventure, Drama","Lion prince Simba and his father are targeted by his bitter uncle, who wants to ascend the throne himself.",88,93,8.5
Life of Brian,1979,Comedy,"Born on the original Christmas in the stable next door to Jesus Christ, Brian of Nazareth spends his life being mistaken for a messiah.",94,96,8
Before Midnight,2013,"Drama, Romance",We meet Jesse and Celine nine years on in Greece. Almost two decades have passed since their first meeting on that train bound for Vienna.,109,98,7.9
A Fistful of Dollars,1964,"Drama, Western","A wandering gunfighter plays two rival families against each other in a town torn apart by greed, pride, and revenge.",99,98,7.9
Sullivan's Travels,1941,"Adventure, Comedy, Drama",Hollywood director John L. Sullivan sets out to experience life as a homeless person in order to gain relevant life experience for his next movie.,90,100,7.9
BlacKkKlansman,2018,"Biography, Comedy, Crime","In this story inspired by true events, Ron Stallworth, an African-American Colorado police officer, successfully infiltrates the local branch of the Ku Klux Klan with the help of a white Jewish colleague.",135,96,7.5
Fargo,1996,"Crime, Drama, Thriller","Various chronicles of deception, intrigue, and murder in and around frozen Minnesota. All of these tales mysteriously lead back one way or another to Fargo, North Dakota.",98,95,8.1
The Grapes of Wrath,1940,Drama,"An Oklahoma family, driven off their farm by the poverty and hopelessness of the Dust Bowl, joins the westward migration to California, suffering the misfortunes of the homeless in the Great Depression.",129,100,8.1
The Lost Weekend,1945,"Drama, Film-Noir",The desperate life of a chronic alcoholic is followed through a four-day drinking bout.,101,97,7.9
Sing Street,2016,"Comedy, Drama, Music","A young lad notices a beautiful girl who begins to occupy his thoughts. While struggling with poverty, personal relationships and life's woes, he starts a band, hoping to catch her attention.",106,95,7.9
Boyhood,2014,Drama,"The life of Mason, from early childhood to his arrival at college.",165,97,7.9
8 1/2,1963,"Dark Comedy, Epic, Psychological Drama, Showbiz Drama, Drama",A harried movie director retreats into his memories and fantasies.,138,97,8
Battleship Potemkin,1925,"Drama, History, Thriller","In the midst of the Russian Revolution of 1905, the crew of the battleship Potemkin mutiny against the brutal, tyrannical regime of the vessel's officers. The resulting street demonstration in Odessa brings on a police massacre.",66,100,7.9
Marriage Story,2019,"Drama, Romance",A stage director and his actor wife struggle through a grueling divorce that pushes them to their personal and creative extremes. Noah Baumbach's incisive and compassionate look at a marriage breaking up and a family staying together.,137,95,7.9
Lost in Translation,2003,"Comedy, Drama",A fading movie star falls for a lonely young woman in Tokyo.,102,95,7.7
The French Connection,1971,"Action, Crime, Drama","A pair of NYPD detectives in the Narcotics Bureau stumble onto a heroin smuggling ring based in Marseilles, but stopping them and capturing their leaders proves an elusive goal.",104,97,7.7
The Lord of the Rings: The Fellowship of the Ring,2001,"Adventure, Drama, Fantasy",A meek Hobbit from the Shire and eight companions set out on a journey to destroy the powerful One Ring and save Middle-earth from the Dark Lord Sauron.,178,92,8.9
Once Upon a Time in the West,1968,"Drama, Western","The short tells the story of John Wayne, a 64-year-old man with an unknown past who constantly struggles to abandon his psychopathic habits, but, unfortunately, fails. But can he live with that? Can he live with the weight of death in his hands?",166,96,8.5
The Lord of the Rings: The Return of the King,2003,"Adventure, Drama, Fantasy",Gandalf and Aragorn lead the World of Men against Sauron's army to draw his gaze from Frodo and Sam as they approach Mount Doom with the One Ring.,201,94,9
Moana,2016,"Animation, Adventure, Comedy","In ancient Polynesia, when a terrible curse incurred by the demigod Maui reaches Moana's island, she answers the Ocean's call to seek out Maui to set things right.",107,95,7.6
Sling Blade,1996,Drama,"Karl Childers, a simple man hospitalized since his childhood murder of his mother and her lover, is released to start a new life in a small town.",135,97,8
Grand Illusion,1937,"Drama, War","During WWI, two French soldiers are captured and imprisoned in a German P.O.W. camp. Several escape attempts follow until they are eventually sent to a seemingly inescapable fortress.",113,97,8.1
The Thin Man,1934,"Comedy, Crime, Mystery","Former detective Nick Charles and his wealthy wife Nora investigate a murder case, mostly for the fun of it.",91,98,7.9
The Diving Bell and the Butterfly,2007,"Biography, Drama","When Julian Schnabel decided to make a film out of of Jean-Dominique Bauby's autobiography The Diving Bell and the Butterfly, he was taking on a radical film making challenge that was both technically difficult and emotionally challenging: the story follows Bauby himself as he writes the book - even though he had been completely paralyzed by a massive stroke in the prime of his life. Join us as we look at the unusual visual and storytelling techniques employed to put the viewer inside Bauby's first-person experience - and how watching this film played very differently for us in the time of COVID-19.",112,94,8
The Discreet Charm of the Bourgeoisie,1972,"Comedy, Drama, Fantasy","A surreal, virtually plotless series of dreams centered around six middle-class people and their consistently interrupted attempts to have a meal together.",102,98,7.8
The Truman Show,1998,"Comedy, Drama",An insurance salesman begins to suspect that his whole life is actually some sort of reality TV show.,103,94,8.2
The Red Circle,1970,"Crime, Drama, Thriller","After leaving prison, master thief Corey crosses paths with a notorious escapee and an alcoholic former policeman. The trio proceed to plot an elaborate heist.",140,96,7.9
Ford v Ferrari,2019,"Action, Biography, Drama",American car designer Carroll Shelby and driver Ken Miles battle corporate interference and the laws of physics to build a revolutionary race car for Ford in order to defeat Ferrari at the 24 Hours of Le Mans in 1966.,152,92,8.1
Three Colors: Blue,1993,"Drama, Music, Mystery",A woman struggles to find a way to live her life after the death of her husband and child.,98,97,7.8
The Straight Story,1999,"Biography, Drama","Alvin Straight, a 73-year-old, learns that his estranged brother, Lyle is critically ill. Unable to drive, Alvin embarks on a journey from Iowa to Mt. Zion, by riding a lawn mower. Will he succeed?",112,95,8
Au Hasard Balthazar,1966,Drama,The story of a mistreated donkey and the people around him. A study on saintliness and a sister piece to Bresson's Mouchette.,95,100,7.7
True Grit,2010,"Drama, Western",A stubborn teenager enlists the help of a tough U.S. Marshal to track down her father's murderer.,110,95,7.6
Room,2015,"Drama, Thriller","A little boy is held captive in a room with his mother since his birth, so he has never known the world outside.",118,93,8.1
Mother,2009,"Crime, Drama, Mystery",A mother desperately searches for the killer who framed her son for a girl's horrific murder.,129,96,7.7
Rosemary's Baby,1968,"Drama, Horror","A young couple trying for a baby moves into an aging, ornate apartment building on Central Park West, where they find themselves surrounded by peculiar neighbors.",137,97,8
Local Hero,1983,"Comedy, Drama","An American oil company has plans for a new refinery and sends someone to Scotland to buy up an entire village, but things don't go as expected.",111,100,7.3
Oppenheimer,2023,"Biography, Drama, History","A dramatization of the life story of J. Robert Oppenheimer, the physicist who had a large hand in the development of the atomic bombs that brought an end to World War II.",180,93,8.3
Diabolique,1955,"Crime, Drama, Horror",The wife and mistress of a loathed school principal plan to murder him with what they believe is the perfect alibi.,117,95,8.1
Logan,2017,"Action, Drama, Sci-Fi","In a future where mutants are nearly extinct, an elderly and weary Logan leads a quiet life. But when Laura, a mutant child pursued by scientists, comes to him for help, he must get her to safety.",137,93,8.1
Playtime,1967,Comedy,"Monsieur Hulot curiously wanders around a high-tech Paris, paralleling a trip with a group of American tourists. Meanwhile, a nightclub/restaurant prepares its opening night, but it's still under construction.",155,98,7.8
A Quiet Place,2018,"Drama, Horror, Sci-Fi",A family struggles for survival in a world invaded by blind alien creatures with ultra-sensitive hearing.,90,96,7.5
