title,year,genre,plot,runtime (minutes),RT rating (%),imdb rating
A Night at the Opera,1935,"Comedy, Music, Musical",A sly business manager and the wacky friends of two opera singers in Italy help them achieve success in America while humiliating their stuffy and snobbish enemies.,96,97,7.8
Tim Burton's The Nightmare Before Christmas,1993,"Documentary, Short","Jack Skellington, king of Halloween Town, discovers Christmas Town, but his attempts to bring Christmas to his home causes confusion.",25,95,7.8
In the Mood for Love,2000,"Drama, Romance",Two people have a chance encounter in a convenience store.,98,92,8.1
In the Heat of the Night,1967,"Drama, Mystery, Thriller","The cases and adventures of the police forces in and around Sparta, Mississippi.",110,96,7.9
Hidden Figures,2016,"Biography, Drama, History",Three female African-American mathematicians play a pivotal role in astronaut John Glenn's launch into orbit while dealing with racial and gender discrimination.,127,93,7.8
Umberto D,1952,Drama,An elderly man and his dog struggle to survive on his government pension in Rome.,89,98,8.2
My Left Foot,1989,"Biography, Drama","Christy Brown, born with cerebral palsy, learns to paint and write with his only controllable limb - his left foot.",103,98,7.8
Bringing Up Baby,1938,Comedy,"While trying to secure a $1 million donation for his museum, a befuddled paleontologist is pursued by a flighty and often irritating heiress and her pet leopard, Baby.",102,97,7.8
Sense and Sensibility,1995,"Drama, Romance","Rich Mr. Dashwood dies, leaving his second wife and her three daughters poor by the rules of inheritance. The older two daughters are the title opposites.",136,97,7.7
Call Me by Your Name,2017,"Drama, Romance","In the summer of 1983, 17-year-old Elio is spending the days with his family at their villa in Lombardy, Italy. He soon meets 24-year-old Oliver, an intern working for Elio's father. They discover the heady beauty of awakening desire.",132,95,7.8
Air,2023,"Drama, Sport",The history of the game-changing partnership between a then undiscovered Michael Jordan and Nike's fledgling basketball division which revolutionized the world of sports and culture with the Air Jordan brand.,111,93,7.4
Brazil,1985,"Drama, Sci-Fi, Thriller",A bureaucrat in a dystopic society becomes an enemy of the state as he pursues the woman of his dreams.,132,98,7.8
Dune: Part Two,2024,"Action, Adventure, Drama","Paul Atreides unites with the Fremen while on a warpath of revenge against the conspirators who destroyed his family. Facing a choice between the love of his life and the fate of the universe, he endeavors to prevent a terrible future.",166,92,8.5
Shaun of the Dead,2004,"Comedy, Horror","The uneventful, aimless lives of a London electronics salesman and his layabout roommate are disrupted by the zombie apocalypse.",99,92,7.9
Yojimbo,1961,"Action, Drama, Thriller",A crafty ronin comes to a town divided by two criminal gangs and decides to play them against each other to free the town.,110,96,8.2
The Sting,1973,"Comedy, Crime, Drama",Two grifters team up to pull off the ultimate con.,129,93,8.3
Roman Holiday,1953,"Comedy, Drama, Romance",A bored and sheltered princess escapes her guardians and falls in love with an American newsman in Rome.,118,96,8
The Departed,2006,"Crime, Drama, Thriller",An undercover cop and a mole in the police attempt to identify each other while infiltrating an Irish gang in South Boston.,151,91,8.5
Boyz N the Hood,1991,"Crime, Drama","Follows the lives of three young males living in the Crenshaw ghetto of Los Angeles, dissecting questions of race, relationships, violence, and future prospects.",112,96,7.8
Lawrence of Arabia,1962,"Adventure, Biography, Drama","The story of T.E. Lawrence, the English officer who successfully united and led the diverse, often warring, Arab tribes during World War I in order to fight the Turks.",227,93,8.3
The Manchurian Candidate,1962,"Drama, Thriller",An American POW in the Korean War is brainwashed as an unwitting assassin for an international Communist conspiracy.,126,97,7.9
Day for Night,1973,"Comedy, Drama, Romance","A committed film director struggles to complete his movie while coping with a myriad of crises, personal and professional, among the cast and crew.",116,98,8
Badlands,1973,"Action, Crime, Drama","An impressionable teenage girl from a dead-end town, and her older greaser boyfriend, embark on a killing spree in the South Dakota Badlands.",94,97,7.7
Amores perros,2000,"Drama, Thriller","An amateur dog fighter, a supermodel, and a derelict assassin, all separately struggling to find love, find their lives transformed by a devastating car wreck in Mexico City.",154,93,8
The Triplets of Belleville,2003,"Animation, Adventure, Comedy","When her grandson is kidnapped during the Tour de France, Madame Souza and her beloved pooch Bruno team up with the Belleville Sisters--an aged song-and-dance team from the days of Fred Astaire--to rescue him.",80,94,7.7
It's a Wonderful Life,1946,"Drama, Family, Fantasy",George is sick of seeing the film It's A Wonderful Life on every channel this time of year. He wishes the film was never made. An angel appears and grants him that wish. He discovers how horrible the world would be if the film It's A Wonderful Life never existed in the first place.,130,94,8.6
The Lives of Others,2006,"Drama, Mystery, Thriller","In 1984 East Berlin, an agent of the secret police conducting surveillance on a writer and his lover finds himself becoming increasingly absorbed by their lives.",137,92,8.4
Some Like It Hot,1959,"Comedy, Music, Romance","After two male musicians witness a mob hit, they flee the state in an all-female band disguised as women, but further complications set in.",121,95,8.2
Princess Mononoke,1997,"Animation, Adventure, Fantasy","While seeking to cure himself of a curse, young warrior Ashitaka stumbles into a conflict between the people of Iron Town and Princess Mononoke, a girl raised by wolves, who will stop at nothing to prevent the destruction of her home.",133,93,8.3
Guardians of the Galaxy,2014,"Action, Adventure, Comedy",A group of intergalactic criminals must pull together to stop a fanatical warrior with plans to purge the universe.,121,92,8
The Bourne Ultimatum,2007,"Action, Mystery, Thriller",Jason Bourne dodges a ruthless C.I.A. official and his Agents from a new assassination program while searching for the origins of his life as a trained killer.,115,92,8
Almost Famous,2000,"Adventure, Comedy, Drama",A high-school boy in the early 1970s is given the chance to write a story for Rolling Stone magazine about an up-and-coming rock band as he accompanies them on their concert tour.,122,91,7.9
Young Frankenstein,1974,Comedy,"An American grandson of the infamous scientist, struggling to prove that his grandfather was not as insane as people believe, is invited to Transylvania, where he discovers the process that reanimates a dead body.",106,95,8
Back to the Future,1985,"Adventure, Comedy, Sci-Fi","Marty McFly, a 17-year-old high school student, is accidentally sent 30 years into the past in a time-traveling DeLorean invented by his close friend, the maverick scientist Doc Brown.",116,93,8.5
This Is Spinal Tap,1984,"Comedy, Music","Spinal Tap, one of England's loudest bands, is chronicled by film director Marty DiBergi on what proves to be a fateful tour.",82,96,7.9
Wild Tales,2014,"Comedy, Drama, Thriller",Six short stories that explore the extremities of human behavior involving people in distress.,122,94,8.1
Die Hard,1988,"Action, Thriller","A New York City cop, John McClane, tries to save his estranged wife and several others taken hostage by terrorists during a Christmas Eve party at the Nakatomi Plaza Skyscraper in Los Angeles, California.",132,94,8.2
Aguirre: The Wrath of God,1972,"Action, Adventure, Biography","In the 16th century, the ruthless and insane Don Lope de Aguirre leads a Spanish expedition in search of El Dorado.",95,96,7.8
To Be or Not to Be,1942,"Comedy, Romance, War","During the German occupation of Poland, an acting troupe becomes embroiled in a Polish soldier's efforts to track down a German spy.",99,96,8.1
The Apartment,1960,"Comedy, Drama, Romance","A Manhattan insurance clerk tries to rise in his company by letting its executives use his apartment for trysts, but office politics and his own romantic hopes complicate matters.",125,93,8.3
City of God,2002,"Crime, Drama","In the slums of Rio, two kids' paths diverge as one struggles to become a photographer and the other a kingpin.",130,91,8.6
White Heat,1949,"Action, Crime, Drama",A psychopathic criminal with a mother complex makes a daring break from prison and leads his old gang in a chemical plant payroll heist.,114,94,8.1
The Big Sleep,1946,"Crime, Film-Noir, Mystery","Private detective Philip Marlowe is hired by a wealthy family. Before the complex case is over, he's seen murder, blackmail--and what might be love.",114,96,7.9
Andrei Rublev,1966,"Biography, Drama, History","The life, times and afflictions of the fifteenth-century Russian iconographer St. Andrei Rublev.",189,96,8
City Lights,1931,"Comedy, Drama, Romance","With the aid of a wealthy erratic tippler, a dewy-eyed tramp who has fallen in love with a sightless flower girl accumulates money to be able to help her medically.",87,95,8.5
Being There,1979,"Comedy, Drama","After the death of his employer forces him out of the only home he's ever known, a simpleminded, sheltered gardener becomes an unlikely trusted advisor to a powerful tycoon and an insider in Washington politics.",130,95,7.9
Hotel Rwanda,2004,"Biography, Drama, History","Paul Rusesabagina, a hotel manager, houses over a thousand Tutsi refugees during their struggle against the Hutu militia in Rwanda, Africa.",121,91,8.1
Shang-Chi and the Legend of the Ten Rings,2021,"Action, Adventure, Fantasy","Shang-Chi, the master of weaponry-based Kung Fu, is forced to confront his past after being drawn into the Ten Rings organization.",132,92,7.3
Breathless,1959,"Caper, Crime, Drama","A small-time crook, hunted by the authorities for a car theft and the murder of a police officer, attempts to persuade a hip American journalism student to run away with him to Italy.",90,95,7.7
Wings of Desire,1987,"Drama, Fantasy, Romance","An angel tires of his purely ethereal life of merely overseeing the human activity of Berlin's residents, and longs for the tangible joys of physical existence when he falls in love with a mortal.",128,95,7.9
Marvel's the Avengers,2012,"Action Epic, Alien Invasion, Superhero, Action, Sci-Fi",Earth's mightiest heroes must come together and learn to fight as a team if they are going to stop the mischievous Loki and his alien army from enslaving humanity.,143,91,8
Run Lola Run,1998,"Action, Crime, Thriller","After a botched money delivery, Lola has 20 minutes to come up with 100,000 Deutschmarks.",80,94,7.6
Throne of Blood,1957,Drama,"A war-hardened general, egged on by his ambitious wife, works to fulfill a prophecy that he would become lord of Spider's Web Castle.",110,96,8
All the President's Men,1976,"Drama, History, Thriller","""The Washington Post"" reporters Bob Woodward and Carl Bernstein uncover the details of the Watergate scandal that leads to President Richard Nixon's resignation.",138,94,7.9
Raging Bull,1980,"Biography, Drama, Sport","The life of boxer Jake LaMotta, whose violence and temper that led him to the top in the ring destroyed his life outside of it.",129,92,8.1
Spider-Man: Far From Home,2019,"Action, Adventure, Comedy","Peter Parker, the beloved superhero Spider-Man, faces four destructive elemental monsters while on holiday in Europe. Soon, he receives help from Mysterio, a fellow hero with mysterious origins.",129,91,7.4
The Hidden Fortress,1958,"Adventure, Drama","Lured by gold, two greedy peasants unknowingly escort a princess and her general across enemy lines.",126,96,8
Apocalypse Now,1979,"Drama, Mystery, War",A U.S. Army officer serving in Vietnam is tasked with assassinating a renegade Special Forces Colonel who sees himself as a god.,147,90,8.4
Beauty and the Beast,1946,"Drama, Fantasy, Romance","To save her father, a girl who always puts others before herself promises to live her life in a lavish castle with a strange beast.",93,96,7.9
The Killing,1956,"Crime, Drama, Film-Noir","A police investigation, the saga of a grieving family, and a Seattle mayoral campaign all interlock after the body of 17-year-old Rosie Larsen is found in the trunk of a submerged car.",84,96,7.9
Amélie,2001,"Comedy, Romance","Despite being caught in her imaginative world, young waitress Amelie decides to help people find happiness. Her quest to spread joy leads her on a journey during which she finds true love.",122,90,8.3
"Steamboat Bill, Jr.",1928,"Action, Comedy, Drama",The effete son of a cantankerous riverboat captain comes to join his father's crew.,70,96,7.8
Central Station,1998,Drama,"The emotive journey of a former schoolteacher who writes letters for illiterate people, and a young boy whose mother has just died, as they search for the father he never knew.",110,94,8
Taxi Driver,1976,"Crime, Drama","A mentally unstable veteran works as a nighttime taxi driver in New York City, where the perceived decadence and sleaze fuels his urge for violent action.",114,89,8.2